操作系统概述,操作系统采用各种合理有效的管理方法替用户管理好计算机系统中的各种软硬件资源，通过多任务并发或并行执行的方式共享计算机系统资源，最大限度地提高资源利用率；操作系统为用户提供了一个方便、安全、高效地使用计算机资源的接口。,P1-P41
进程、线程管理,操作系统必须有效地控制进程执行，给进程分配资源，允许进程之间共享信息，保护每个进程在运行期间不受其他进程的干扰，实现进程的互斥、同步和通信。,P45-P78
进程同步与通信,多个进程并发执行时，有些进程是相互独立的，有些进程之间是相互影响、相互合作的。相互影响、相互合作的进程间存在制约关系，称为进程间同步问题与通信问题。如果处理不好，就会影响进程的执行过程，甚至产生错误的运行结果，操作系统设计者必须对该问题给予高度重视。,P80-P113
处理机调度,处理机是计算机中最重要的系统资源，多个并发执行进程在系统中运行时，它们必然竞争处理机。处理机调度就是操作系统对处理机进行合理分配，它是进程管理的重要基本功能之一。,P117-P141
死锁,死锁是多道程序并发执行带来的又一严重问题，它是操作系统乃至并发程序设计中最难处理的问题之一。死锁产生的根本原因有两个：资源竞争和推进顺序不当。,P145-P164
内存管理,内存的主要职责是存放程序、数据以及操作结果。任何程序只有装入内存后才能被处理机读取并执行，管理好内存是操作系统的重要任务之一。,P168-P200
虚拟存储管理,为了执行比内存容量大的程序和提高系统并发执行程度，现代操作系统中多采用虚拟存储技术。虚拟存储技术通过统一管理主、辅存空间，从逻辑上扩充主存容量，给用户造成一种系统内具有巨大主存空间共用户使用的“假象”。,P203-P232
I/O设备管理,I/O设备的多样性和差异性使得I/O设备管理模块成为操作系统中最庞杂、最繁琐的部分，控制并管理好所有I/O设备，协调好多个进程对I/O设备的争用是操作系统的基本功能之一。,P237-P291
文件系统,为了减轻用户负担和保证系统安全，操作系统中具有对信息进行控制管理的模块，称为文件系统。文件系统是建立在存储设备上的信息存储管理系统，它是操作系统的重要组成部分。,P296-P336
